{
  "schema_version": "claims-0.1",
  "document": {
    "raw_item_id": "af424964-8b72-489b-b6bc-ea7d6218aeb3",
    "language": "es",
    "document_date": "2026-05-04"
  },
  "claims": [
    {
      "claim_id": "c1",
      "group_id": "g1_mv_hondius_2026-05-02_cluster",
      "claim_kind": "syndromic_cluster",
      "polarity": "positive",
      "domains": [
        "human"
      ],
      "disease_verbatim": "enfermedades respiratorias agudas graves",
      "pathogen_verbatim": null,
      "subject": {
        "verbatim": "a bordo del crucero",
        "canonical_name": null,
        "subject_type": "population",
        "confidence": 0.78
      },
      "locations": [
        {
          "country": "Cabo Verde",
          "country_iso2": null,
          "admin1": null,
          "admin2": null,
          "locality": null,
          "region": null,
          "precision": "country",
          "confidence": 0.74,
          "role": "current_location"
        }
      ],
      "event_date": {
        "start": "2026-05-02",
        "end": null,
        "precision": "day"
      },
      "reference_period": {
        "start": {
          "date": null,
          "year": null,
          "month": null,
          "precision": "unknown",
          "verbatim": null
        },
        "end": {
          "date": null,
          "year": null,
          "month": null,
          "precision": "unknown",
          "verbatim": null
        },
        "period_type": "unknown",
        "verbatim": null
      },
      "metric": {
        "reported": false,
        "name": null,
        "value_numeric": null,
        "value_text": null,
        "unit": null,
        "as_of_date": null,
        "as_of_year": null,
        "as_of_month": null,
        "as_of_precision": "unknown",
        "as_of_verbatim": null
      },
      "diagnostics": {
        "test_reported": false,
        "test_type": null,
        "method": null,
        "target": null,
        "specimen": null,
        "result": "unknown"
      },
      "genomics": {
        "sequence_reported": false,
        "lineage": null,
        "clade": null,
        "accession": null,
        "test_result": "unknown"
      },
      "transmission": {
        "human_to_human": "unknown",
        "animal_to_human": "unknown",
        "vector_borne": "unknown"
      },
      "verification_status": "reported",
      "summary": "Notificación de un conglomerado de enfermedades respiratorias agudas graves a bordo del crucero MV Hondius.",
      "evidence": [
        {
          "type": "text",
          "text": "El 2 de mayo, el Centro Nacional de Epidemiología de nuestro país recibió la notificación de un conglomerado de enfermedades respiratorias agudas graves a bordo del crucero",
          "location_in_document": null,
          "page_number": null
        }
      ],
      "confidence": 0.74
    },
    {
      "claim_id": "c2",
      "group_id": "g1_mv_hondius_2026-05-02_cluster",
      "claim_kind": "death_count",
      "polarity": "positive",
      "domains": [
        "human"
      ],
      "disease_verbatim": null,
      "pathogen_verbatim": null,
      "subject": {
        "verbatim": "a bordo del crucero",
        "canonical_name": null,
        "subject_type": "population",
        "confidence": 0.72
      },
      "locations": [
        {
          "country": "Cabo Verde",
          "country_iso2": null,
          "admin1": null,
          "admin2": null,
          "locality": null,
          "region": null,
          "precision": "country",
          "confidence": 0.7,
          "role": "current_location"
        }
      ],
      "event_date": {
        "start": "2026-05-02",
        "end": null,
        "precision": "day"
      },
      "reference_period": {
        "start": {
          "date": null,
          "year": null,
          "month": null,
          "precision": "unknown",
          "verbatim": null
        },
        "end": {
          "date": null,
          "year": null,
          "month": null,
          "precision": "unknown",
          "verbatim": null
        },
        "period_type": "unknown",
        "verbatim": null
      },
      "metric": {
        "reported": true,
        "name": "deaths",
        "value_numeric": 3,
        "value_text": null,
        "unit": "persons",
        "as_of_date": "2026-05-02",
        "as_of_year": null,
        "as_of_month": null,
        "as_of_precision": "day",
        "as_of_verbatim": "El 2 de mayo"
      },
      "diagnostics": {
        "test_reported": false,
        "test_type": null,
        "method": null,
        "target": null,
        "specimen": null,
        "result": "unknown"
      },
      "genomics": {
        "sequence_reported": false,
        "lineage": null,
        "clade": null,
        "accession": null,
        "test_result": "unknown"
      },
      "transmission": {
        "human_to_human": "unknown",
        "animal_to_human": "unknown",
        "vector_borne": "unknown"
      },
      "verification_status": "reported",
      "summary": "Se informaron tres fallecimientos en el conglomerado a bordo del crucero.",
      "evidence": [
        {
          "type": "text",
          "text": "El 2 de mayo, el Centro Nacional de Epidemiología de nuestro país recibió la notificación de un conglomerado de enfermedades respiratorias agudas graves a bordo del crucero, incluyendo tres fallecimientos",
          "location_in_document": null,
          "page_number": null
        }
      ],
      "confidence": 0.73
    },
    {
      "claim_id": "c3",
      "group_id": "g1_mv_hondius_2026-05-02_cluster",
      "claim_kind": "diagnostic_result",
      "polarity": "positive",
      "domains": [
        "human"
      ],
      "disease_verbatim": null,
      "pathogen_verbatim": "hantavirus",
      "subject": {
        "verbatim": "un pasajero",
        "canonical_name": null,
        "subject_type": "human",
        "confidence": 0.76
      },
      "locations": [
        {
          "country": "Cabo Verde",
          "country_iso2": null,
          "admin1": null,
          "admin2": null,
          "locality": null,
          "region": null,
          "precision": "country",
          "confidence": 0.7,
          "role": "current_location"
        }
      ],
      "event_date": {
        "start": "2026-05-02",
        "end": null,
        "precision": "day"
      },
      "reference_period": {
        "start": {
          "date": null,
          "year": null,
          "month": null,
          "precision": "unknown",
          "verbatim": null
        },
        "end": {
          "date": null,
          "year": null,
          "month": null,
          "precision": "unknown",
          "verbatim": null
        },
        "period_type": "unknown",
        "verbatim": null
      },
      "metric": {
        "reported": false,
        "name": null,
        "value_numeric": null,
        "value_text": null,
        "unit": null,
        "as_of_date": null,
        "as_of_year": null,
        "as_of_month": null,
        "as_of_precision": "unknown",
        "as_of_verbatim": null
      },
      "diagnostics": {
        "test_reported": true,
        "test_type": "confirmación laboratorial",
        "method": null,
        "target": "hantavirus",
        "specimen": null,
        "result": "positive"
      },
      "genomics": {
        "sequence_reported": false,
        "lineage": null,
        "clade": null,
        "accession": null,
        "test_result": "unknown"
      },
      "transmission": {
        "human_to_human": "unknown",
        "animal_to_human": "unknown",
        "vector_borne": "unknown"
      },
      "verification_status": "confirmed",
      "summary": "Un pasajero tuvo confirmación laboratorial de hantavirus.",
      "evidence": [
        {
          "type": "text",
          "text": "un pasajero con confirmación laboratorial de hantavirus",
          "location_in_document": null,
          "page_number": null
        }
      ],
      "confidence": 0.76
    },
    {
      "claim_id": "c4",
      "group_id": "g1_mv_hondius_2026-05-02_cluster",
      "claim_kind": "transmission_statement",
      "polarity": "uncertain",
      "domains": [
        "human"
      ],
      "disease_verbatim": null,
      "pathogen_verbatim": "hantavirus",
      "subject": {
        "verbatim": "la ruta de transmisión",
        "canonical_name": null,
        "subject_type": "other",
        "confidence": 0.6
      },
      "locations": [
        {
          "country": "Cabo Verde",
          "country_iso2": null,
          "admin1": null,
          "admin2": null,
          "locality": null,
          "region": null,
          "precision": "country",
          "confidence": 0.62,
          "role": "current_location"
        }
      ],
      "event_date": {
        "start": null,
        "end": null,
        "precision": "unknown"
      },
      "reference_period": {
        "start": {
          "date": null,
          "year": null,
          "month": null,
          "precision": "unknown",
          "verbatim": null
        },
        "end": {
          "date": null,
          "year": null,
          "month": null,
          "precision": "unknown",
          "verbatim": null
        },
        "period_type": "unknown",
        "verbatim": null
      },
      "metric": {
        "reported": false,
        "name": null,
        "value_numeric": null,
        "value_text": null,
        "unit": null,
        "as_of_date": null,
        "as_of_year": null,
        "as_of_month": null,
        "as_of_precision": "unknown",
        "as_of_verbatim": null
      },
      "diagnostics": {
        "test_reported": false,
        "test_type": null,
        "method": null,
        "target": null,
        "specimen": null,
        "result": "unknown"
      },
      "genomics": {
        "sequence_reported": false,
        "lineage": null,
        "clade": null,
        "accession": null,
        "test_result": "unknown"